name,cooking_time,text,author-username
"Окрошка с колбасой",50,"Окрошка с колбасой - рецепт для жаркого летнего дня. Отличный способ быстро и вкусно перекусить, как можно меньше стоя у плиты, - это приготовить окрошку на кефире, с колбасой, вареной картошкой, свежими огурцами.",admin
"Долма",120,"Фарш из баранины со специями, рисом и курдючным жиром, завернутый в виноградные листья, - все это томится на слабом огне, и в результате получается та самая, неповторимая, очень вкусная и ароматная долма. И сколько бы не спорили о происхождении и названии этого кулинарного чуда, для нас главное, что истина - в долме!) Осталось только приготовить, чтобы в этом убедиться.",bradpitt
"Сырное суфле",40,"Это рецепт сырного суфле классического, которое не требует особых кулинарных навыков и способностей.",batman
"Шоколадный пудинг",25,"Самый простой шоколадный крем-пудинг готовится из какао, молока, яйца и крахмала.",admin
"Отбивные котлеты по-итальянски",15,"Отбивные котлеты с сыром и зеленью, обжаренные в сухарях, - это объедение.",bradpitt
"Лазанья (классический рецепт)",80,"Лазанья - это кулинарный конструктор, как и любая паста. И, как и любая паста, лазанья - это очень вкусно и сытно. Существуют десятки видов этого итальянского блюда. Самый распространенный рецепт лазаньи - с томатно-мясным соусом болоньезе и соусом бешамель. Именно такую лазанью будем готовить, но рецепт проще и быстрее, чем традиционный.",batman
"Шакшука со свежими помидорами",35,"Часто про совсем простое блюдо как раз и говорят «пальчики оближешь». Шакшука со свежими помидорами – это именно такой вариант. Сочные, ароматные овощи со свежими куриными яйцами создают просто идеальное блюдо для завтрака. Обязательно приготовьте его и зарядитесь отличным настроением на весь день.",mister-x